{"tasks":[{"task":"T1","state":"S0-anon","firstTool":"get_signin_status","canConstructArgs":true,"missingInfo":[],"ambiguousWith":[],"wouldAskHuman":false,"notes":"The task most closely matches the unsigned-in state, and the call takes no arguments."},{"task":"T2","state":"S1-emp-home","firstTool":"get_session_scope","canConstructArgs":true,"missingInfo":[],"ambiguousWith":[],"wouldAskHuman":false,"notes":"A project code is required to create the report, so I would first read the employee's chargeable projects."},{"task":"T3","state":"S2-emp-draft-clean","firstTool":"add_expense_line","canConstructArgs":false,"missingInfo":["merchant","absolute receipt date in YYYY-MM-DD"],"ambiguousWith":[],"wouldAskHuman":true,"notes":"The amount, currency, and transport category are clear, but the required merchant is absent. The supplied files do not establish the calendar date needed to resolve “last Tuesday.”"},{"task":"T4","state":"S2-emp-draft-clean","firstTool":"list_receipts","canConstructArgs":true,"missingInfo":[],"ambiguousWith":[],"wouldAskHuman":false,"notes":"I could check attached receipt metadata first, but no tool transfers a photo from the phone into the page. Completing the task would later require the employee to attach it and would also require the dinner line id."},{"task":"T5","state":"S3-emp-draft-dirty","firstTool":"validate_expense_report","canConstructArgs":true,"missingInfo":[],"ambiguousWith":[],"wouldAskHuman":false,"notes":"This state explicitly represents an open draft with a blocking violation, and validation returns the complaint and fix hint."},{"task":"T6","state":"S2-emp-draft-clean","firstTool":"submit_expense_report","canConstructArgs":true,"missingInfo":[],"ambiguousWith":[],"wouldAskHuman":false,"notes":"The tool requires no arguments, though submission pauses for the employee's review and signature in the page."},{"task":"T7","state":"S3-emp-draft-dirty","firstTool":"explain_missing_tool","canConstructArgs":true,"missingInfo":[],"ambiguousWith":[],"wouldAskHuman":false,"notes":"I would call it with the known absent name submit_expense_report; the dirty state explains why submission is unavailable."},{"task":"T8","state":"S5-aud","firstTool":"explain_missing_tool","canConstructArgs":true,"missingInfo":[],"ambiguousWith":[],"wouldAskHuman":false,"notes":"I would ask about add_expense_line. The auditor surface offers no mutation tool, so the requested addition cannot be completed in this session."}],"rubric":{"R1":{"score":1,"confidence":"high","why":"Most names map cleanly to intent, but get_report and get_open_report are somewhat confusable from names alone."},"R2":{"score":1,"confidence":"high","why":"T3's add_expense_line call is blocked by the missing required merchant and unresolved absolute date; the other selected first calls are constructible."},"R3":{"score":2,"confidence":"high","why":"Write descriptions identify refusal conditions, and explain_missing_tool describes a structured violation envelope with code, severity, field, fix, and candidates."},"R4":{"score":2,"confidence":"high","why":"explain_missing_tool is present in every state and explicitly explains why a named tool is absent and what restores it."},"R5":{"score":1,"confidence":"high","why":"Descriptions are generally useful but often include extra policy or implementation narrative beyond what is needed to choose and form the call."},"R6":{"score":2,"confidence":"high","why":"Every readOnlyHint tool is described as reading, listing, validating, or explaining without changing underlying data."}},"gate":{"tasksCompletable":5,"passed":false},"worstProblem":"The surface cannot ingest T4's phone photo and cannot perform T8's requested mutation in the reviewer session; T3 also requires a merchant and an absolute date that the supplied material does not provide."}